{
 "schema_version": 1,
 "work_order": "M01",
 "discovery_title": "The Lost Treasure",
 "verified": false,
 "install_sha256": "b4e780ab84cf31d85b8452fbfcec1478137768e32d9a75ccedc4c1847c631978",
 "catalog_id": "mission/ch1-m01",
 "world_id": "world/c1c",
 "program_id": "script/c1c-m01-zrdr",
 "closure_sha256": null,
 "source_spans": [
    {"asset_id": "GOSDATA/ASSETS/BINARIES/langui.dll", "offset": 92292, "length": 50, "sha256": "357e6bb05f1d2872a00e0976fdde44561cd5bb6a56d9f555d85d0ff1481faf49"},
    {"asset_id": "ZBD/C1C/M01/zrdr.zbd", "offset": 0, "length": 91171, "sha256": "33b60a402dd8a8374faf02db808c074181754370e29d1b5115aad01b41b22c9f"}
  ],
 "required_actor_ids": [],
 "objective_ids": [],
 "interaction_ids": [],
 "media_ids": [],
 "stunt_ids": [],
 "reward_ids": [],
 "difficulty_ids": [],
 "unknowns": ["initial player and wingmate configurations: not bound from original data at this stage", "actor/spawn/route sets: not bound from original data at this stage", "objective graph: measured for this mission — M01's control record declares 58 OBJECTIVE blocks and 358 fields, 308 of them recovered into the engine lifecycle model and 50 unrecovered and named (45 block-level control directives and 5 record-level directive fields, world-side operations the control lowering owns per the owner's 2026-10-10 ruling on #1219) (M01-B-OBJ); both terminal blocks — OBJECTIVE24 spelling INSTANTWIN and OBJECTIVE40 spelling INSTANTLOSS — load dormant behind the -1 sentinel and wake only through the record's own effect graph and observed world facts, and driven runs reach each terminal through the production host (M01-B-WAKE). Residual: the in-play-bit writers, DEDG's member-field rewrites, TRAVELERS' producers and the TICK_DEPENDS_ON_OBJ roots stay untraced off the terminal paths, ObjectiveRecovery::program() still refuses this record by the declared-schema gap, and no original ordinary-play run exists — M01-C stays the settling stage", "interaction authorizations: not bound from original data at this stage", "script/native coverage: the mission opcode table is still unmeasured, but the empty-signature-table premise does not describe this archive's control program — the control member is a text directive program, classified through the F13-C directive probe as 58 blocks, 353 directive sites and 43 distinct keys, of which 41 are measured, 2 are terminal outcomes and 0 are unknown, so M01's control program is fully accounted (M01-B-OPC). Residual: the other reader members (aiv.zrd, targets.zrd and the rest) are still binary-probed with unestablished role, M01's INTERP loading body was not examined, and no numeric binary signature claim was written", "required geometry/collision/materials: not bound from original data at this stage", "audio/dialogue/video/camera cues: not bound from original data at this stage", "initial and terminal campaign state: not bound from original data at this stage", "optional/stunt/reward ids: not bound from original data at this stage", "difficulty branches: not bound from original data at this stage", "exact failure/success precedence: measured for this mission — the record's only outcomes are OBJECTIVE24's INSTANTWIN and OBJECTIVE40's INSTANTLOSS, each reached through its own measured wake chain under the host's measured per-tick order (world observation, lifecycle timer pass, completion pass, completion effects), and a driven run settles each terminal from the program's own Action::Finish, never a shortcut (M01-B-WAKE). Residual: no run reports both terminals' world facts, no original executable was run, and ordinary-play precedence stays with M01-C", "campaign progression: the successor mission is not bound to original mission ids", "closure_sha256: the mission dependency closure hash needs the retail content catalog (F14-D) and decoded mission programs (F37/F38)"],
 "evidence_ids": []
}
