{
 "schema_version": 1,
 "work_order": "M09",
 "discovery_title": "Perils for Blake",
 "verified": false,
 "install_sha256": "b4e780ab84cf31d85b8452fbfcec1478137768e32d9a75ccedc4c1847c631978",
 "catalog_id": "mission/ch2-m04",
 "world_id": "world/c1",
 "program_id": "script/c1-m04-zrdr",
 "closure_sha256": null,
 "source_spans": [
    {"asset_id": "GOSDATA/ASSETS/BINARIES/langui.dll", "offset": 95304, "length": 46, "sha256": "357e6bb05f1d2872a00e0976fdde44561cd5bb6a56d9f555d85d0ff1481faf49"},
    {"asset_id": "ZBD/C1/M04/zrdr.zbd", "offset": 0, "length": 74692, "sha256": "5ffc1abd91a5919179448b397ec6bde48dd19fd8ba6f311b4362d76cb84c4263"}
  ],
 "required_actor_ids": [],
 "objective_ids": [],
 "interaction_ids": [],
 "media_ids": [],
 "stunt_ids": [],
 "reward_ids": [],
 "difficulty_ids": [],
 "unknowns": ["initial player and wingmate configurations: not bound from original data at this stage", "actor/spawn/route sets: not bound from original data at this stage", "objective graph: not bound from original data at this stage", "interaction authorizations: not bound from original data at this stage", "script/native coverage: the mission opcode table is unmeasured, so F13-C probes every program against an empty signature table", "required geometry/collision/materials: not bound from original data at this stage", "audio/dialogue/video/camera cues: not bound from original data at this stage", "initial and terminal campaign state: not bound from original data at this stage", "optional/stunt/reward ids: not bound from original data at this stage", "difficulty branches: not bound from original data at this stage", "exact failure/success precedence: not measured", "campaign progression: the successor mission is not bound to original mission ids", "closure_sha256: the mission dependency closure hash needs the retail content catalog (F14-D) and decoded mission programs (F37/F38)", "title ruling: the declared title \"Perils for Blake\" is carried by no localized row; the owner ruled (Rally #470, 2026-10-25) that this work order names the mission whose short name is \"Peril for Blake\" (row 3488, long-name row 3458) — an inferred join, not an original observation"],
 "evidence_ids": []
}
