{
 "schema_version": 1,
 "work_order": "M12",
 "discovery_title": "The Great Plane Robbery",
 "verified": false,
 "install_sha256": "b4e780ab84cf31d85b8452fbfcec1478137768e32d9a75ccedc4c1847c631978",
 "catalog_id": "mission/ch3-m02",
 "world_id": "world/c2",
 "program_id": "script/c2-m01-zrdr",
 "closure_sha256": null,
 "source_spans": [
    {"asset_id": "GOSDATA/ASSETS/BINARIES/langui.dll", "offset": 95446, "length": 62, "sha256": "357e6bb05f1d2872a00e0976fdde44561cd5bb6a56d9f555d85d0ff1481faf49"},
    {"asset_id": "ZBD/C2/M01/zrdr.zbd", "offset": 0, "length": 100905, "sha256": "d6e9315d580a0570ae8744d2c1b154c4c1af9086bf45cc2fcc125f0921fd9f63"}
  ],
 "required_actor_ids": [],
 "objective_ids": [],
 "interaction_ids": [],
 "media_ids": [],
 "stunt_ids": [],
 "reward_ids": [],
 "difficulty_ids": [],
 "unknowns": ["initial player and wingmate configurations: not bound from original data at this stage", "actor/spawn/route sets: not bound from original data at this stage", "objective graph: not bound from original data at this stage", "interaction authorizations: not bound from original data at this stage", "script/native coverage: the mission opcode table is unmeasured, so F13-C probes every program against an empty signature table", "required geometry/collision/materials: not bound from original data at this stage", "audio/dialogue/video/camera cues: not bound from original data at this stage", "initial and terminal campaign state: not bound from original data at this stage", "optional/stunt/reward ids: not bound from original data at this stage", "difficulty branches: not bound from original data at this stage", "exact failure/success precedence: not measured", "campaign progression: the successor mission is not bound to original mission ids", "closure_sha256: the mission dependency closure hash needs the retail content catalog (F14-D) and decoded mission programs (F37/F38)", "passenger identity: the shipped data binds no passenger or extraction entity to this mission — the archive's only passenger-named string is the shared `location.zrd` teleport entry `Passenger_hangar`, and no directive, target, actor, startup animation, world node or message id names one (measured on `zbd/c2/m01` by M06-B-FU2, which bound this archive under the pre-correction campaign layout; task M01-ARCHIVE-DECISION corrected the layout and the entry follows the archive it was measured on); needs an original reference run under M12-C or the owner's ruling"],
 "evidence_ids": []
}
